[
  {"ledger_entry_id":"L1","claim_id":"C1","evidence_id":"E1","source_id":"S1","verification_state":"verified-primary","evidential_standing":"SUPPORTS","verification_method":"synthetic direct inspection","locator":"case 1","limitations":["single institution"],"counterevidence_refs":["E3"],"checked_at":"2026-08-20T00:00:00Z","checked_by":"researcher:R1","verification_event_ref":"verification:example:L1","source_digest":"sha256:1111111111111111111111111111111111111111111111111111111111111111","provenance":"synthetic example"},
  {"ledger_entry_id":"L2","claim_id":"C1","evidence_id":"E2","source_id":"S2","verification_state":"verified-primary","evidential_standing":"QUALIFIES","verification_method":"synthetic direct inspection","locator":"case 2","limitations":["supports only prompted tasks"],"counterevidence_refs":["E3"],"checked_at":"2026-08-20T00:00:00Z","checked_by":"researcher:R1","verification_event_ref":"verification:example:L2","source_digest":"sha256:2222222222222222222222222222222222222222222222222222222222222222","provenance":"synthetic example"},
  {"ledger_entry_id":"L3","claim_id":"C1","evidence_id":"E3","source_id":"S3","verification_state":"verified-primary","evidential_standing":"CONTRADICTS","verification_method":"synthetic direct inspection","locator":"case 3","limitations":[],"counterevidence_refs":[],"checked_at":"2026-08-20T00:00:00Z","checked_by":"researcher:R1","verification_event_ref":"verification:example:L3","source_digest":"sha256:3333333333333333333333333333333333333333333333333333333333333333","provenance":"synthetic example"}
]
